{
  "schema_version": "1.0.0",
  "git_sha": "2f026da",
  "generated_at_ns": 1788255001705254144,
  "environment": {
    "os": "Windows 11",
    "cpu": "Intel64 Family 6 Model 170 Stepping 4, GenuineIntel",
    "cores": 22,
    "ram": "32GB",
    "rust_version": "rustc 1.95.0 (59807616e 2026-04-14)",
    "build_profile": "debug"
  },
  "contract_tests": {
    "passed": 72,
    "failed": 0,
    "total": 72,
    "suites": ["data_semantics", "descriptor_contract", "resource_contract", "discovery_contract", "profile_contract", "control_contract", "session_lifecycle", "data_plane", "fault_tolerance", "subprocess_recovery"]
  },
  "performance": {
    "throughput_updates_per_sec": 125000,
    "ipc_p95_ms": 12.5,
    "ipc_p99_ms": 38.0,
    "configure_1k_ms": 45,
    "configure_10k_ms": 920,
    "configure_50k_ms": 4470,
    "rss_delta_mib": 128,
    "control_p95_ms": 2.1,
    "control_p99_ms": 8.4
  },
  "soak": {
    "duration_hours": 0.017,
    "rss_growth_percent": 2.1,
    "leak_detected": false,
    "note": "60s short soak multi-endpoint+reconnect passed"
  },
  "real_device_matrix": [
    {
      "driver": "simulator",
      "capability": "write",
      "status": "passed",
      "detail": "Writable sim.counter via Control32 reliable, p95 2ms"
    },
    {
      "driver": "s7",
      "capability": "probe",
      "status": "passed",
      "detail": "192.168.15.97:102 OpenConnection ok (rack0/slot1)"
    },
    {
      "driver": "s7",
      "capability": "write",
      "status": "skipped",
      "detail": "DB10 INT 145 read ok, WriteVar 0x05 timeout pending PUT/GET+non-optimized (skipped per user)"
    },
    {
      "driver": "focas2",
      "capability": "probe",
      "status": "passed",
      "detail": "192.168.15.165:8193 OpenConnection ok"
    },
    {
      "driver": "focas2",
      "capability": "pmc_rdpmcrng",
      "status": "passed",
      "detail": "R100..118 WORD10→1 range_call verified"
    },
    {
      "driver": "focas2",
      "capability": "command",
      "status": "passed",
      "detail": "165 status command via Control32 Succeeded (192.168.15.165:8193)"
    }
  ]
}
